{
  "entry": "Alex prefers draft guidance that names the strategic move first, then offers concise wording choices.",
  "category": "communication_preference",
  "source": "synthetic_onboarding_example",
  "confidence": "high",
  "date_added": "2026-06-21",
  "review_cadence": "quarterly",
  "privacy_sensitivity": "public",
  "public_use_permission": true
}
